{
  "control_method": 0,
  "flight_controls": [
    6,
    5,
    2,
    4,
    1,
    3,
    0,
    0,
    0,
    0,
    0,
    0
  ],
  "high_scores": [
    [
      {
        "name": "HAZEL PHOENIX",
        "score": 150000
      },
      {
        "name": "MERYL REES",
        "score": 120000
      },
      {
        "name": "DAVE COLLEDGE",
        "score": 90000
      },
      {
        "name": "SCOTT WALKER",
        "score": 60000
      },
      {
        "name": "DAVE VALIANT",
        "score": 30000
      }
    ],
    [
      {
        "name": "STEFAN LANCASTER",
        "score": 300000
      },
      {
        "name": "JOHN AVERY",
        "score": 260000
      },
      {
        "name": "RICH SHANE",
        "score": 220000
      },
      {
        "name": "TOD",
        "score": 180000
      },
      {
        "name": "ROB WYATT",
        "score": 140000
      }
    ],
    [
      {
        "name": "MARGARET LEYLAND",
        "score": 500000
      },
      {
        "name": "MARK POTENTE",
        "score": 460000
      },
      {
        "name": "ANDREW PERRINS",
        "score": 420000
      },
      {
        "name": "JASMINE LAKER",
        "score": 380000
      },
      {
        "name": "JAY BUTLER",
        "score": 340000
      }
    ],
    [
      {
        "name": "TIM PARRY",
        "score": 1000000
      },
      {
        "name": "ANDREW HUTCHINGS",
        "score": 950000
      },
      {
        "name": "KELLY FORESTER",
        "score": 900000
      },
      {
        "name": "JAKE PHILLIPS",
        "score": 850000
      },
      {
        "name": "ROB HILL",
        "score": 800000
      }
    ]
  ],
  "language": 0,
  "music_on": 1,
  "music_tracks": [
    1,
    1,
    1,
    1,
    1,
    1,
    1,
    1
  ],
  "music_volume": 8,
  "pilot": "",
  "reserved": [
    0,
    0,
    0,
    0
  ],
  "schema": "game-configuration-v1",
  "sound_on": 1,
  "sound_volume": 8,
  "stick_bounds": {
    "x_max": 1020,
    "x_min": 0,
    "y_max": 1020,
    "y_min": 0,
    "z_max": 1020,
    "z_min": 0
  },
  "version": 3,
  "video_on": 1
}
